Inventory,class,String,Class,"NEW, OPEN_BOX",Sub-categorization of the inventory used for categorization or filtering.,,,,
Inventory,costCenter,String,Cost center,L89A,Code or number of the cost center responsible for this product.,,,,
Inventory,costCenterDescription,String,Cost center description,Purchased products,Description of the cost center responsible for this product.,,,,
Inventory,criticalPartIndicator,String,Critical part indicator,YES,Code designating the criticality of the product at this location.,,,,
Inventory,daysOfSupply,Float,Days of supply,30,Expected lead time in days needed when orders are placed for the product or material.,,,,
Inventory,daysOfSupplyAboveUpperThreshold,Float,Days of supply above upper threshold,10,A calculated entry. The number of days of supply above the recorded upper limit for this location.,,,,
Inventory,daysOfSupplyBelowLowerThreshold,Float,Days of supply below lower threshold,10,A calculated entry. The number of days of supply below the recorded lower limit for this location.,,,,
Inventory,daysOfSupplyLowerThreshold,Float,Days of supply lower threshold,40,The wanted lower limit or boundary for the inventory days of supply.,,,,
Inventory,daysOfSupplyTarget,Float,Days of supply target,60,Optimal days of inventory supply wanted to have on hand for the product.,,,,
Inventory,daysOfSupplyUpperThreshold,Float,Days of supply upper threshold,60,The wanted upper limit or boundary for the inventory days of supply.,,,,
Inventory,expectedLeadTime,Float,Expected lead time,6,Expected lead time in days needed when orders are placed for the product or material.,time: date|timestamp,,,
Inventory,expiringThreshold,Float,Expiring threshold,10,Time in days past which a product or material is considered aged.,,,,
Inventory,fixedLotSize,Float,Fixed lot size,100,An indication that a fixed lot size can be purchased.,,,,
Inventory,futureStockoutCount,Int,Future stockout count,2,Count of the number of future stockouts known.,,,,
Inventory,futureStockouts,StockoutsCursor,Future stockouts,(see object),Reference to stockouts associated with the inventory.,,,,
Inventory,inventoryLots,InventoryLotsCursor,Inventory lots,(see object),Reference to inventory lots associated with the inventory.,,,,
Inventory,inventoryParentType,String,Inventory parent type,ONHAND,Type of parent plan used for categorization or filtering.,,,,
Inventory,inventoryType,String,Inventory type,"PRODUCT, ITEM",Type of product used for categorization or filtering.,,,,
Inventory,lotSizeProcedure,String,Lot size procedure,None,"Special instructions, which regard the lot size and handling of the product.",,,,
Inventory,minimumLotSize,Float,Minimum lot size,100,Indicates the minimum orderable lot size that can be purchased.,,,,
Inventory,nextStockOverageStartDate,DateTime,Next stock overage start date,2023-06-28T14:30:36+0000,The date and time when next overage is expected to begin (ISO 8601).,date: time|timestamp,,,
Inventory,nextStockUnderageStartDate,DateTime,Next stock underage start date,2023-06-28T14:30:36+0000,The date and time when next underage is expected to begin (ISO 8601).,date: time|timestamp,,,
Inventory,nextStockoutDuration,Float,Next stockout duration,3,The number of days the next stockout is expected to last.,,,,
Inventory,nextStockoutEndDate,DateTime,Next stockout end date,2023-06-28T14:30:36+0000,The date and time when next stockout is expected to end (ISO 8601).,date: time|timestamp,,,
Inventory,nextStockoutQuantity,Float,Next stockout quantity,44,Total lost sales quantity expected during the next stockout.,quantity: qty,,,
Inventory,nextStockoutRevenueRisk,Float,Next stockout revenue risk,5000,Total lost sales revenue expected during the next stockout.,,,,
Inventory,nextStockoutRevenueRiskCurrency,String,Next stockout revenue risk currency,USD,Currency designation in ISO 4217 format.,,,,
Inventory,nextStockoutStartDate,DateTime,Next stockout start date,2023-06-28T14:30:36+0000,The date and time when next stockout is expected to begin (ISO 8601).,date: time|timestamp,,,
Inventory,palletQuantity,Float,Pallet quantity,38016,Quantity of products in one pallet.,quantity: qty,,,
Inventory,plannerCode,String,Inventory planner code,123,Code indicating the owning planner of this product for categorization and filtering.,,,,
Inventory,purchasingGroup,String,Purchasing group,D77A2,Group or department code responsible for the inventory.,,,,
Inventory,quantity,Float,Quantity,100,Quantity of products or materials in the inventory.,quantity: qty,,,
Inventory,quantityAboveUpperThreshold,Float,Quantity above upper threshold,10,A calculated entry. The quantity of product above the recorded upper limit for this location.,quantity: qty,,,
Inventory,quantityBelowLowerThreshold,Float,Quantity below low threshold,10,A calculated entry. The quantity of product below the recorded lower limit for this location.,quantity: qty,,,
Inventory,quantityBlocked,Float,Quantity blocked,4,"Quantity of product, which is on hold.",quantity: qty,,,
Inventory,quantityLowerThreshold,Float,Low quantity threshold,150,Configured threshold below which the inventory quanity is considered low.,quantity: qty,,,
Inventory,quantityOnOrder,Float,Quantity on order,3,Total quantity of product on new orders in to this location.,quantity: qty; order: PO|sale|sold,,,
Inventory,quantityOnPurchaseRequisition,Float,Quantity on purchase requisition,22,Total quantity of product on open PO requisitions in to this location.,quantity: qty,,,
Inventory,quantityOnTransfer,Float,Quantity on transfer,23,Total quantity of product on transfer orders to and from this location.,quantity: qty,,,
Inventory,quantityOnTransferIn,Float,Quantity on transfer in,22,Quantity of product on transfer orders in to this location.,quantity: qty,,,
Inventory,quantityOnTransferOut,Float,Quantity on transfer out,5,Quantity of product on transfer orders out of this location.,quantity: qty,,,
Inventory,quantityTarget,Float,Quantity target,100,Optimal quantity wanted to have on-hand for the product.,quantity: qty,,,
Inventory,quantityUnits,String,Quantity units,EA,Units of measure from the source system.  Standard UOM or ISO format.,quantity: qty,,,
Inventory,quantityUpperThreshold,Float,Quantity upper threshold,200,The wanted upper limit or boundary for the inventory quantity.,quantity: qty,,,
Inventory,reorderLevel,Float,Reorder level,160,Quantity of available inventory below which a reorder is needed.,,,,
Inventory,reservationOrders,Float,Reservation for orders,20,Quantity of inventory reserved for orders.,,,,
Inventory,reservationPickup,Float,Reservation for pick up,3,Quantity of inventory that is reserved for pick up.,,,,
Inventory,reservationShip,Float,Reservation for ship,4,Quantity of inventory reserved for shipments.,ship: shipped,,,
Inventory,safetyStock,Float,Safety stock,100,Quantity wanted to keep on hand to accommodate for demand spikes.,,,,
Inventory,segment,String,Segment,UNSEGMENTED,Sub categorization of the inventory used for categorization or filtering.,,,,
Inventory,shelfLife,Float,Shelf life,90,The shelf life of the product or material in days.,,,,
Inventory,specialProcurementKey,String,Special procurement key,See blue book,Special instructions that regard the procurement of the product.,,,,
Inventory,status,String,Status,Active,"Status of the inventory on hand. For example, Active.",,,,
Inventory,turns,Float,Turns,10,The cost of goods sold divided by the average inventory for the same period.,,,,
Inventory,value,Float,Value,1229,Value or price of the product or material in inventory.,,,,
Inventory,valueCurrency,String,Value currency,USD,Currency designation in ISO 4217 format.,,,,
Inventory,velocityCode,String,Velocity code,456,The code indicating the category of sales volume expected for the product.,,,,
Inventory,weight,Float,Weight,0.05,Gross weight of the items in inventory.,,,,
InventoryLot,   --------   ,   --------   ,   --------   ,   --------   ,   --------   ,   --------   ,Inventory and planning,Inventory management,   --------   
InventoryLot,segment,String,Segment,UNSEGMENTED,Sub categorization of the inventory lot used for categorization or filtering.,,,,required fields: segment
InventoryLot,product,Product,Product,(see object),Reference to product record for this inventory lot.,product: creation|prod,,,required fields: product.partNumber
InventoryLot,lotCode,String,Lot code,239845720,Lot or serial code.,,,,required fields: lotCode
InventoryLot,location,Location,Location,(see object),Reference to location associated with the inventory lot.,location: parcel,,,required fields: location.locationIdentifier
InventoryLot,inventoryParentType,String,Inventory parent type,ONHAND,Type of parent plan used for categorization or filtering.,,,,required fields: inventoryParentType
InventoryLot,additionalSortableNumValues,[UniqueNameNumberPair],Additional sortable num values,,,,,,
InventoryLot,additionalSortableStringValues,[UniqueNameStringPair],Additional sortable string values,,,,,,
InventoryLot,approachingExpirationDate,DateTime,Approaching expiration date,2023-06-28T14:30:36+0000,A calculated entry. The date and time when the lot will be within the expiration window (ISO 8601).,date: time|timestamp,,,
InventoryLot,calculatedNumValue,Float,Calculated num value,,,,,,
InventoryLot,calculatedStringValue,String,Calculated string value,,,,,,
InventoryLot,class,String,Class,"NEW, OPEN_BOX",Sub-categorization of the inventory lot used for categorization or filtering.,,,,
InventoryLot,expirationDate,DateTime,Expiration date,2023-06-28T14:30:36+0000,Manufacturer-applied date the lot will expire (ISO 8601).,date: time|timestamp,,,
InventoryLot,inventory,Inventory,Inventory,(see object),Reference to inventory associated with the inventory lot.,,,,
InventoryLot,inventoryType,String,Inventory type,"PRODUCT, ITEM",The type of product used for categorization or filtering.,,,,
InventoryLot,productLot,ProductLot,Product lot,(see object),Reference to product lot associated with the inventory lot.,product: creation|prod,,,
InventoryLot,quantity,Float,Quantity,12,Quantity of products or materials in the inventory lot.,quantity: qty,,,
InventoryLot,quantityAvailable,Float,Quantity available,12,Quantity of product in this inventory lot that is not reserved or otherwise unfit for sale.,quantity: qty,,,
InventoryLot,quantityDelta,Float,Quantity delta,2,A change in the inventory's quantity.,quantity: qty,,,
InventoryLot,quantityUnits,String,Quantity units,EA,Units of measure from the source system.  Standard UOM or ISO format.,quantity: qty,,,
InventoryLot,sourceLink,String,Source link,http://source-system.com/home.html,A direct link to the source of the data if available.,,,,
InventoryLot,status,String,Status,Partial Reserve,"Status of the inventory lot. For example, Partial Reserve.",,,,
InventoryLot,storageDate,String,Storage date,2023-06-28T14:30:36+0000,The date and time the lot was put into inventory (ISO 8601).,date: time|timestamp,,,
InventoryLot,storageLocation,Location,Storage location,(see object),Reference to the specific location of the inventory lot.,location: parcel,,,
InventoryLot,value,Float,Value,1229,Value or price of the product or material in the inventory lot.,,,,
InventoryLot,valueCurrency,String,Value currency,USD,Currency designation in ISO 4217 format.,,,,
InventoryPlan,   --------   ,   --------   ,   --------   ,   --------   ,   --------   ,   --------   ,Inventory and planning,Supply and demand planning|Inventory management,   --------   
InventoryPlan,startDate,String,Start date,2023-06-28,The date and time that the supply plan starts (ISO 8601).,date: time|timestamp,,,required fields: startDate
InventoryPlan,product,Product,Product,(see object),Reference to product records for this inventory plan.,product: creation|prod,,,required fields: product.partNumber
InventoryPlan,planParentType,String,Plan parent type,"PLAN, INTRANSIT, PO_PLACED",Type of parent plan used for categorization or filtering.,,,,required fields: planParentType
InventoryPlan,location,Location,Location,(see object),Reference to location associated with the inventory plan.,location: parcel,,,required fields: location.locationIdentifier
InventoryPlan,duration,Float,Duration,1,Days represented in the supply plan quantity.,,,,required fields: duration
InventoryPlan,additionalSortableNumValues,[UniqueNameNumberPair],Additional sortable num values,,,,,,
InventoryPlan,additionalSortableStringValues,[UniqueNameStringPair],Additional sortable string values,,,,,,
InventoryPlan,calculatedNumValue,Float,Calculated num value,,,,,,
InventoryPlan,calculatedStringValue,String,Calculated string value,,,,,,
InventoryPlan,class,String,Class,"NEW, OPEN_BOX",Sub-categorization of the plan used for categorization or filtering.,,,,
InventoryPlan,confidence,Float,Confidence,0.99,A calculated entry. The value that indicates the source system confidence or accuracy.,,,,
InventoryPlan,planType,String,Plan type,"PRODUCT, ITEM",The type of product in the plan used for categorization or filtering.,,,,
InventoryPlan,planningCycle,String,Planning cycle,2021Q3,"An indication of a planning cycle number or code, which created the data.",,,,
InventoryPlan,quantity,Float,Quantity,1200,Quantity of products or materials in the inventory plan.,quantity: qty,,,
InventoryPlan,quantityUnits,String,Quantity units,EA,Units of measure from the source system.  Standard UOM or ISO format.,quantity: qty,,,
InventoryPlan,reference,String,Reference,IV,Reference information that indicates the source or details of the plan.,,,,
InventoryPlan,source,String,Source,IV,"Indication of the source system, which created the data.",,,,
InventoryPlan,sourceLink,String,Source link,http://source-system.com/home.html,A direct link to the source of the data if available.,,,,
InventoryPlan,validFrom,String,Valid from,2023-06-28T14:30:36+0000,The date and time that the supply plan is valid from (ISO 8601).,,,,
InventoryPlan,validTo,String,Valid to,2023-06-28T14:30:36+0000,The date and time that the supply plan is valid to (ISO 8601).,,,,
SupplyPlan,   --------   ,   --------   ,   --------   ,   --------   ,   --------   ,   --------   ,Inventory and planning,Supply and demand planning,   --------   
SupplyPlan,startDate,String,Start date,2023-06-28,The date and time that the supply plan starts (ISO 8601).,date: time|timestamp,,,required fields: startDate
SupplyPlan,product,Product,Product,(see object),Reference to product records for this supply plan.,product: creation|prod,,,required fields: product.partNumber
SupplyPlan,planParentType,String,Plan category,"PLAN, INTRANSIT, PO_PLACED",Type of parent plan used for categorization or filtering.,,,,required fields: planParentType
SupplyPlan,location,Location,Location,(see object),Reference to location associated with the supply plan.,location: parcel,,,required fields: location.locationIdentifier
SupplyPlan,duration,Float,Duration,1,Days represented in the supply plan quantity.,,,,required fields: duration
SupplyPlan,additionalSortableNumValues,[UniqueNameNumberPair],Additional sortable num values,,,,,,
SupplyPlan,additionalSortableStringValues,[UniqueNameStringPair],Additional sortable string values,,,,,,
SupplyPlan,calculatedNumValue,Float,Calculated num value,,,,,,
SupplyPlan,calculatedStringValue,String,Calculated string value,,,,,,
SupplyPlan,class,String,Class,"NEW, OPEN_BOX",Sub-categorization of the plan used for categorization or filtering.,,,,
SupplyPlan,pcfComplianceRecord,ComplianceRecord,Pcf compliance record,(see object),Reference to the product carbon footprint associated with the supply.,,,,
SupplyPlan,planType,String,Plan type,"PRODUCT, ITEM",The type of product in the plan used for categorization or filtering.,,,,
SupplyPlan,planningCycle,String,Planning cycle,2021Q3,"An indication of a planning cycle number or code, which created the data.",,,,
SupplyPlan,quantity,Float,Quantity,1200,Quantity of products or materials in the supply plan.,quantity: qty,,,
SupplyPlan,quantityUnits,String,Quantity units,EA,Units of measure from the source system.  Standard UOM or ISO format.,quantity: qty,,,
SupplyPlan,reference,String,Reference,IV,Reference information that indicates the source or details of the plan.,,,,
SupplyPlan,source,String,Source,IV,"Indication of the source system, which created the data.",,,,
SupplyPlan,sourceLink,String,Source link,http://source-system.com/home.html,A direct link to the source of the data if available.,,,,
SupplyPlan,validFrom,String,Valid from,2023-06-28T14:30:36+0000,The date and time that the supply plan is valid from (ISO 8601).,,,,
SupplyPlan,validTo,String,Valid to,2023-06-28T14:30:36+0000,The date and time that the supply plan is valid to (ISO 8601).,,,,
Catalog,   --------   ,   --------   ,   --------   ,   --------   ,   --------   ,   --------   ,Master data,Supply and demand planning|Inbound supply|Manufacturing|Inventory management|Inventory allocation|Fulfillment|Outbound logistics|Payments and Invoices|Supplier compliance management|Track and trace|ESG management|Product carbon footprint,   --------   
Catalog,levelType,String,Level type,"CATEGORY, BRAND, FAMILY, LINE, SEGMENT",Type of level that is used for categorization or filtering.,,,,required fields: levelType
Catalog,code,String,Code,HMC,The actual name value of the level type.,,,,required fields: code
Catalog,catalogType,String,Catalog type,"PRODUCT, ITEM",The top-level catalog type when multiple items exist.,,,,required fields: catalogType
Catalog,additionalSortableNumValues,[UniqueNameNumberPair],Additional sortable num values,,,,,,
Catalog,additionalSortableStringValues,[UniqueNameStringPair],Additional sortable string values,,,,,,
Catalog,calculatedNumValue,Float,Calculated num value,,,,,,
Catalog,calculatedStringValue,String,Calculated string value,,,,,,
Catalog,currentYearEmissionsTarget,Float,Current year emissions target,159.88,The target value for the current year emissions.,,,,
Catalog,description,String,Description,Hardware Maintenance Control,Description of the product.,,,,
Catalog,emissionsFactorGroup,FactorGroup,Emissions factor group,(see object),Reference to the emissions factor group that is applied to this product category level.,,,,
Catalog,factors,FactorCursor,Factors,(see object),A deprecated entry. Reference to the factors used in score calculation.,,,,
Catalog,name,String,Name,HMC,Descriptive name of the catalog code.,,,,
Catalog,parentCode,String,Parent code,,Code of the parent catalog,,,,
Catalog,parentLevel,String,Parent level,(see object),Reference to parent catalog id associated with the catalog.,,,,
Catalog,preferredPcfRecordProvider,Organization,Preferred pcf record provider,,Reference to organization that is the preferred PCF record provider for products in this category.,,,,
Catalog,sourceLink,String,Source link,http://source-system.com/home.html,A direct link to the source of the data if available.,,,,
Location,   --------   ,   --------   ,   --------   ,   --------   ,   --------   ,   --------   ,Master data,Risk management|Supply and demand planning|Inbound supply|Manufacturing|Inventory management|Inventory allocation|Fulfillment|Outbound logistics|Payments and Invoices|Multi-tier supplier mapping|Supplier compliance management|Track and trace|Asset management|ESG management,   --------   
Location,locationIdentifier,String,Location ID,9K8,Unique identifier for a location.,location: parcel; identifier: id|number|code|num|no.,,,required fields: locationIdentifier
Location,additionalSortableNumValues,[UniqueNameNumberPair],Additional sortable num values,,,,,,
Location,additionalSortableStringValues,[UniqueNameStringPair],Additional sortable string values,,,,,,
Location,address1,String,Address1,Keji South 1st Rd,Street address line one.,,,,
Location,address2,String,Address2,n/a,Street address line two.,,,,
Location,calculatedNumValue,Float,Calculated num value,,,,,,
Location,calculatedStringValue,String,Calculated string value,,,,,,
Location,city,String,City,Guangdong Sheng,Name of the location city.,,,,
Location,coordinates,String,Coordinates,"35.792603, -78.883066","Geospatial coordinates of the shipment's current location (latitude, longitude).",,,,
Location,country,String,Country,China,Country name. A country code that is translated into a string.,,,,
Location,countyRegion,String,County region,Los Angeles County,A geographic region within a state or province that is used for administrative or political purposes.,,,,
Location,distributionsGroupIds,[String!],Distributions group ids,(see object),Reference to the distribution group identifiers associated with the location.,,,,
Location,earliestTimestamp,DateTime,Earliest timestamp,2022-06-02T00:00:00+0000,The date and time of earliest event referencing this Location (ISO 8601).,timestamp: date|time,,,
Location,geo,String,Geo,AP,Name of the location city.,,,,
Location,geoLocation,String,Geo location,"Chicago, IL. 60606 - US",Derived string of the full location.,location: parcel,,,
Location,includeInCorrelation,Boolean,Include in correlation,TRUE,An indication of whether this location is used in correlation calculations.,,,,
Location,latestTimestamp,DateTime,Latest timestamp,2022-06-02T00:00:00+0000,The date and time of most recent event that references this Location (ISO 8601).,timestamp: date|time,,,
Location,locationGroups,LocationGroupsCursor,Location groups,(see object),Reference to location groups associated with the location.,location: parcel,,,
Location,locationName,String,Location name,IBM SHENZHEN,Descriptive name of the organization.,location: parcel,,,
Location,locationSubtype,String,Subtype,"Manufacturing, Distribution, Headquarters",Subtype of location that is used for categorization or filtering.,location: parcel,,,
Location,locationType,String,Location type,"ORGANIZATION, CUSTOMER, SUPPLIER, STORE",Type of location that is used for categorization or filtering.,location: parcel,,,
Location,organizations,OrganizationsCursor,Organizations,(see object),Reference to organizations associated with the location,,,,
Location,owningOrganization,Organization,Owning organization,(see object),Reference to the organization that owns the location.,organization: buyer|vendor|carrier|supplier|customer|org,,,
Location,postalCode,String,Postal code,518057,Postal code or zip code.,postal: zip|zipcode,,,
Location,primaryContact,Contact,Primary contact,(see object),Reference to the primary contact for the location.,contact: employee,,,
Location,secondaryIdentifier,String,Secondary identifier,USA,Additional identifier associated with the location.,identifier: id|number|code|num|no.,,,
Location,shipFromLocationShipments,ShipmentsCursor,Ship from location shipments,(see object),Reference to shipments associated with the send-from location.,ship: shipped; location: parcel,,,
Location,shipToLocationOrderLines,OrderLinesCursor,Ship to location order lines,(see object),Reference to send-to location order lines associated with the location.,ship: shipped; location: parcel; order: PO|sale|sold,,,
Location,shipToLocationOrders,OrdersCursor,Ship to location orders,(see object),Reference to send-to-location orders associated with the location.,ship: shipped; location: parcel,,,
Location,shipToLocationShipments,ShipmentsCursor,Ship to location shipments,(see object),Reference to shipments associated with the send-to location.,ship: shipped; location: parcel,,,
Location,sourceLink,String,Source link,http://source-system.com/home.html,A direct link to the source of the data if available.,,,,
Location,stateProvince,String,State-province,Shenzhen Shi,State or province name.,,,,
Location,status,String,Status,Active,Status of the location.,,,,
LocationGroup,   --------   ,   --------   ,   --------   ,   --------   ,   --------   ,   --------   ,Master data,Risk management|Supply and demand planning|Inbound supply|Manufacturing|Inventory management|Inventory allocation|Fulfillment|Outbound logistics|Payments and Invoices|Multi-tier supplier mapping|Supplier compliance management|Track and trace|Asset management|ESG management,   --------   
LocationGroup,locationGroupIdentifier,String,Location group identifier,Northeast,"Unique identifier for a location group. For example, the Northeast.",location: parcel; identifier: id|number|code|num|no.,,,required fields: locationGroupIdentifier
LocationGroup,additionalSortableNumValues,[UniqueNameNumberPair],Additional sortable num values,,,,,,
LocationGroup,additionalSortableStringValues,[UniqueNameStringPair],Additional sortable string values,,,,,,
LocationGroup,calculatedNumValue,Float,Calculated num value,,,,,,
LocationGroup,calculatedStringValue,String,Calculated string value,,,,,,
LocationGroup,locationGroupName,String,Location group name,Northeast Region,"Descriptive name of the organization. For example, the Northeast Region.",location: parcel,,,
LocationGroup,locationGroupType,String,Location group type,"ORGANIZATION, CUSTOMER, SUPPLIER, STORE",The type of location used for categorization or filtering.,location: parcel,,,
LocationGroup,locations,LocationsCursor,Locations,(see object),Reference to the locations that are included in the location group.,,,,
LocationGroup,sourceLink,String,Source link,http://source-system.com/home.html,A direct link to the source of the data if available.,,,,
Organization,   --------   ,   --------   ,   --------   ,   --------   ,   --------   ,   --------   ,Master data,Risk management|Inbound supply|Manufacturing|Fulfillment|Outbound logistics|Payments and Invoices|Multi-tier supplier mapping|Supplier compliance management|Track and trace|Asset management|ESG management,   --------   
